{
  "task_identity": "harness-backlog-v0.2/KL-016",
  "reviewed_head_sha": "8caf0b6ce6368ddb0b43b81d05029e463232c0f5",
  "review_type": "GENERAL",
  "status": "PASS",
  "findings": [],
  "evidence_refs": [
    "docs/exec-plans/completed/KL-016_RESULT.yaml",
    "docs/exec-plans/evidence/KL-016/checks-89727c8.log",
    "docs/contracts/safety_registry.md",
    "src/kineticloop/contracts/safety_registry.py",
    "src/kineticloop/persistence/safety_registry.py",
    "tests/unit/contracts/test_safety_registry.py",
    "tests/db/test_safety_registry.py"
  ],
  "review_contract_version": "v0.2"
}
