{
  "task_identity": "harness-backlog-v0.2/KL-072",
  "reviewed_head_sha": "decbc03ce0cb895b69a154e4e92b65acce30ab26",
  "review_type": "DB_CONCURRENCY",
  "status": "PASS",
  "findings": [],
  "evidence_refs": [
    "docs/contracts/safety_registry.md",
    "docs/exec-plans/completed/KL-072_RESULT.yaml",
    "docs/exec-plans/evidence/KL-072/checks-200ae79.log",
    "migrations/versions/a3f91c7d2e10_safety_registry_integration.py",
    "src/kineticloop/persistence/safety_registry.py",
    "tests/db/test_migrations.py",
    "tests/db/test_safety_registry.py"
  ],
  "review_contract_version": "v0.2"
}
