{
  "task_identity": "harness-governance-v0.1/HG-049",
  "reviewed_head_sha": "ceed78db431a348aae0b599a5e1b09bb082fb968",
  "review_type": "SECURITY_DATA_BOUNDARY",
  "status": "PASS",
  "findings": [],
  "evidence_refs": [
    "docs/exec-plans/reviews/HG-049/security/REPORT.md",
    "docs/exec-plans/reviews/HG-049/security/verify.py",
    "docs/exec-plans/reviews/HG-049/security/verify-initial.log",
    "docs/exec-plans/reviews/HG-049/security/focused.log",
    "docs/exec-plans/reviews/HG-049/security/focused.xml",
    "docs/exec-plans/reviews/HG-049/security/record-audit.log",
    "docs/exec-plans/evidence/HG-049/checks-4db6952/EXECUTION.json",
    "docs/exec-plans/evidence/HG-049/checks-4db6952/harness-execution-json.json",
    "docs/exec-plans/evidence/HG-049/checks-4db6952/harness-junit-xml.json"
  ],
  "review_contract_version": "v0.2"
}
