{
  "task_identity": "harness-governance-v0.1/HG-021",
  "reviewed_head_sha": "be54cec7f3b06739f8f5c6a41f9d8d979faed2b4",
  "review_type": "DB_CONCURRENCY",
  "status": "PASS",
  "findings": [],
  "evidence_refs": [
    "04_KineticLoop_DB_Schema_Design_v0.2_FROZEN.md",
    "05_KineticLoop_Protocol_v1.2_FROZEN.md",
    ".github/workflows/db.yml",
    "KineticLoop_Harness_Backlog_v0.2.json",
    "KineticLoop_Harness_Traceability_v0.3.json",
    "docs/contracts/immutable_history_permissions.md",
    "docs/contracts/safety_registry.md",
    "docs/exec-plans/active/KL-018.md",
    "docs/exec-plans/completed/KL-072_RESULT.yaml",
    "docs/exec-plans/evidence/HG-021/checks.log",
    "docs/exec-plans/governance/HG-021.yaml",
    "tests/db/test_safety_registry.py",
    "tests/harness/test_validator.py",
    "tools/harness/validate_harness.py"
  ],
  "review_contract_version": "v0.2"
}
