{
  "task_identity": "harness-governance-v0.1/HG-025",
  "reviewed_head_sha": "a00e70fa22b2f9759b557d266abde76ed41800b0",
  "review_type": "DB_CONCURRENCY",
  "status": "PASS",
  "findings": [],
  "evidence_refs": [
    "docs/exec-plans/governance/HG-025.yaml",
    "docs/exec-plans/evidence/HG-025/checks-02d678b.log",
    "docs/exec-plans/active/KL-035.md",
    "KineticLoop_Harness_Backlog_v0.2.json",
    "docs/harness/HARNESS_GOVERNANCE_CONTRACT.md",
    "tools/harness/validate_harness.py",
    "tests/harness/test_validator.py",
    "05_KineticLoop_Protocol_v1.2_FROZEN.md",
    "04_KineticLoop_DB_Schema_Design_v0.2_FROZEN.md",
    "FROZEN_BASELINE.json",
    "12_KineticLoop_Integration_Spec_v0.1.md"
  ],
  "review_contract_version": "v0.2"
}
