{
  "task_identity": "harness-backlog-v0.2/KL-029",
  "reviewed_head_sha": "eed165afbd56d3ae551c46166aaec776cf79e625",
  "review_type": "PROTOCOL",
  "status": "PASS",
  "findings": [],
  "evidence_refs": [
    "docs/exec-plans/active/KL-029.md",
    "tests/db/test_shadow_isolation.py",
    "tests/unit/protocol/test_shadow_isolation.py",
    "docs/contracts/shadow_isolation.md",
    "docs/exec-plans/completed/KL-029_RESULT.yaml",
    "docs/exec-plans/evidence/KL-029/checks-b9fbf9b/checks.json",
    "docs/exec-plans/evidence/KL-029/checks-b9fbf9b/shadow_suite_dc.log",
    "docs/exec-plans/reviews/KL-029/protocol-raw/assessment.md",
    "docs/exec-plans/reviews/KL-029/protocol-raw/audit.py",
    "docs/exec-plans/reviews/KL-029/protocol-raw/audit.json",
    "docs/exec-plans/reviews/KL-029/protocol-raw/audit.log",
    "docs/exec-plans/reviews/KL-029/protocol-raw/pu.log",
    "docs/exec-plans/reviews/KL-029/protocol-raw/pu.xml"
  ],
  "review_contract_version": "v0.2"
}
