{
  "task_identity": "harness-governance-v0.1/HG-015",
  "reviewed_head_sha": "7e068bee3253b7f487f7633610d01807cc0338d1",
  "review_type": "GENERAL",
  "status": "PASS",
  "findings": [],
  "evidence_refs": [
    "CURRENT_DOCUMENT_INDEX.json",
    "docs/harness/HARNESS_GOVERNANCE_CONTRACT.md",
    "docs/harness/THREAD_REVIEW_CONTRACT.md",
    "docs/harness/MERGE_GATE.md",
    "HARNESS_CHANGE.schema.json",
    "INTEGRATION_RECORD.schema.json",
    "THREAD_RESULT.schema.json",
    "THREAD_REVIEW.schema.json",
    "docs/exec-plans/governance/HG-015.yaml",
    "docs/exec-plans/evidence/HG-015/checks.log",
    "docs/exec-plans/integrations/KL-008.json",
    "docs/exec-plans/active/KL-008.md",
    "docs/exec-plans/completed/KL-008_RESULT.yaml",
    "docs/exec-plans/reviews/KL-008/GENERAL.json",
    "docs/exec-plans/reviews/KL-008/PROTOCOL.json",
    "docs/exec-plans/reviews/KL-008/DB_CONCURRENCY.json",
    "docs/exec-plans/evidence/KL-008/checks-efec610.log"
  ],
  "review_contract_version": "v0.2"
}
