{
  "task_identity": "harness-backlog-v0.2/KL-015",
  "reviewed_head_sha": "2b64ab85a67c4f2f3ed5684806b65f692944c937",
  "review_type": "GENERAL",
  "status": "PASS",
  "findings": [],
  "evidence_refs": [
    "docs/exec-plans/active/KL-015.md",
    "CURRENT_DOCUMENT_INDEX.json",
    "docs/exec-plans/milestones/M1.json",
    "05_KineticLoop_Protocol_v1.2_FROZEN.md",
    "04_KineticLoop_DB_Schema_Design_v0.2_FROZEN.md",
    "docs/harness/THREAD_REVIEW_CONTRACT.md",
    "THREAD_REVIEW.schema.json",
    "docs/exec-plans/completed/KL-015_RESULT.yaml",
    "docs/exec-plans/evidence/KL-015/checks-85acbd4.log",
    "docs/exec-plans/evidence/KL-015/regression-85acbd4.log",
    "docs/contracts/repository_transactions.md",
    "migrations/versions/e7a2c4f91d60_t3_candidate_registry_guard.py",
    "src/kineticloop/persistence/transactions.py",
    "tests/unit/persistence/test_transactions.py",
    "tests/db/test_transaction_interfaces.py"
  ],
  "review_contract_version": "v0.2"
}
