{
  "task_identity": "harness-governance-v0.1/HG-002",
  "reviewed_head_sha": "28fc8574d6cd53e05137a0706b7046d6eb524629",
  "review_type": "GENERAL",
  "status": "PASS",
  "findings": [],
  "evidence_refs": [
    "docs/exec-plans/governance/HG-002.yaml",
    "docs/exec-plans/evidence/HG-002/checks.log",
    "docs/exec-plans/integrations/KL-003.json"
  ],
  "review_contract_version": "v0.2"
}
