{
  "task_identity": "harness-governance-v0.1/HG-030",
  "reviewed_head_sha": "930dc8797de69991afa7d80e8cac2e1d1bce3899",
  "review_type": "GENERAL",
  "status": "PASS",
  "findings": [],
  "evidence_refs": [
    "docs/exec-plans/governance/HG-030.yaml",
    "docs/exec-plans/active/KL-025.md",
    "docs/exec-plans/active/KL-024.md",
    "docs/contracts/repository_transactions.md",
    "docs/exec-plans/integrations/KL-015.json",
    "docs/exec-plans/evidence/HG-030/scope_projection_audit-final.log",
    "docs/exec-plans/evidence/HG-030/diff_clean-final.log",
    "docs/exec-plans/evidence/HG-030/ledger_governance_regressions-final.log",
    "docs/exec-plans/evidence/HG-030/harness_structure_valid-final.log",
    "docs/exec-plans/evidence/HG-030/harness_tests_pass-final.log",
    "docs/exec-plans/evidence/HG-030/unit_tests_pass-final.log",
    "docs/exec-plans/evidence/HG-030/lint_passes-final.log",
    "docs/exec-plans/evidence/HG-030/typecheck_passes-final.log"
  ],
  "review_contract_version": "v0.2"
}
