{
  "task_identity": "harness-governance-v0.1/HG-045",
  "reviewed_head_sha": "478a46a418fc759c1843ce24702ccee7aafcddc2",
  "review_type": "SECURITY_DATA_BOUNDARY",
  "status": "PASS",
  "findings": [],
  "evidence_refs": [
    "docs/exec-plans/reviews/HG-045/SECURITY_DATA_BOUNDARY_REPORT.md",
    "docs/exec-plans/governance/HG-045.yaml",
    "docs/exec-plans/active/KL-080.md",
    "docs/exec-plans/evidence/HG-045/SOURCE_AUDIT.md",
    "docs/exec-plans/evidence/HG-045/FEASIBILITY.md",
    "docs/exec-plans/evidence/HG-045/source-probe-26906bd.json",
    "docs/exec-plans/evidence/HG-045/source_probe.py",
    "docs/exec-plans/evidence/HG-045/capture-integrity-263c82e.json",
    "docs/exec-plans/evidence/HG-045/focused-263c82e.json",
    "docs/exec-plans/evidence/HG-045/focused-263c82e.log",
    "docs/exec-plans/evidence/HG-045/harness-263c82e.json",
    "docs/exec-plans/evidence/HG-045/harness-263c82e.log",
    "docs/exec-plans/evidence/HG-045/unit-263c82e.json",
    "docs/exec-plans/evidence/HG-045/unit-263c82e.log",
    "docs/exec-plans/evidence/HG-045/scope_frozen-263c82e.json",
    "docs/exec-plans/evidence/HG-045/integration_provenance-263c82e.json",
    "docs/exec-plans/evidence/HG-045/EVIDENCE_FORMAT.md",
    "tests/harness/test_source_decision_scope.py",
    "tools/harness/validate_harness.py",
    "docs/harness/M3_CLOSURE_CONTRACT.md"
  ],
  "review_contract_version": "v0.2"
}
