{
  "task_identity": "harness-governance-v0.1/HG-060",
  "reviewed_head_sha": "bba4a4d0341473aa9e652b423eedef5d1d1362c8",
  "review_type": "SECURITY_DATA_BOUNDARY",
  "status": "PASS",
  "findings": [],
  "evidence_refs": [
    "docs/exec-plans/reviews/HG-060/SECURITY_DATA_BOUNDARY/report.md",
    "docs/exec-plans/reviews/HG-060/SECURITY_DATA_BOUNDARY/audit.py",
    "docs/exec-plans/reviews/HG-060/SECURITY_DATA_BOUNDARY/audit.json",
    "docs/exec-plans/reviews/HG-060/SECURITY_DATA_BOUNDARY/definitions.log",
    "docs/exec-plans/reviews/HG-060/SECURITY_DATA_BOUNDARY/focused.log",
    "docs/exec-plans/reviews/HG-060/SECURITY_DATA_BOUNDARY/focused.xml",
    "docs/exec-plans/reviews/HG-060/SECURITY_DATA_BOUNDARY/guards.json",
    "docs/exec-plans/reviews/HG-060/SECURITY_DATA_BOUNDARY/storage-audit.json",
    "docs/exec-plans/evidence/HG-060/PACKET.md",
    "docs/exec-plans/evidence/HG-060/SOURCE_IDENTITIES.json",
    "docs/exec-plans/evidence/HG-060/PRESERVATION_DISPOSITION.json",
    "docs/exec-plans/evidence/HG-060/checks-5c1b24369df3/CHECK_INDEX.json"
  ],
  "review_contract_version": "v0.2"
}
