{
  "task_identity": "harness-governance-v0.1/HG-022",
  "reviewed_head_sha": "24881d91a00de1b4e98c2e1c3e34a22f3982327e",
  "review_type": "DB_CONCURRENCY",
  "status": "PASS",
  "findings": [],
  "evidence_refs": [
    "05_KineticLoop_Protocol_v1.2_FROZEN.md",
    "04_KineticLoop_DB_Schema_Design_v0.2_FROZEN.md",
    "FROZEN_BASELINE.json",
    "docs/harness/RESOURCE_LOCKS.md",
    "docs/harness/THREAD_ROUTING.md",
    "docs/harness/THREAD_REVIEW_CONTRACT.md",
    "docs/exec-plans/active/KL-017.md",
    "docs/exec-plans/active/KL-018.md",
    "docs/exec-plans/completed/KL-018_RESULT.yaml",
    "docs/exec-plans/governance/HG-022.yaml",
    "docs/exec-plans/evidence/HG-022/checks.log",
    "KineticLoop_Harness_Backlog_v0.2.json",
    "KineticLoop_Harness_Traceability_v0.3.json",
    "tools/harness/validate_harness.py",
    "tests/harness/test_validator.py",
    ".github/workflows/db.yml"
  ],
  "review_contract_version": "v0.2"
}
