{
  "task_identity": "harness-backlog-v0.2/KL-013",
  "reviewed_head_sha": "2f5174ca5fbdde847f314bd50be067749401a2b0",
  "review_type": "PROTOCOL",
  "status": "PASS",
  "findings": [],
  "evidence_refs": [
    "CURRENT_DOCUMENT_INDEX.json",
    "docs/exec-plans/active/KL-013.md",
    "docs/exec-plans/milestones/M1.json",
    "05_KineticLoop_Protocol_v1.2_FROZEN.md",
    "04_KineticLoop_DB_Schema_Design_v0.2_FROZEN.md",
    "docs/exec-plans/completed/KL-010_RESULT.yaml",
    "docs/exec-plans/completed/KL-011_RESULT.yaml",
    "docs/exec-plans/completed/KL-012_RESULT.yaml",
    "docs/exec-plans/completed/KL-016_RESULT.yaml",
    "docs/contracts/physical_schema_topology.md",
    "docs/contracts/canonical_fact_children.md",
    "docs/contracts/immutable_history_permissions.md",
    "migrations/versions/76fd67f76bd4_frozen_s01_s51_baseline.py",
    "src/kineticloop/persistence/metadata.py",
    "tests/db/test_migrations.py",
    "docs/exec-plans/completed/KL-013_RESULT.yaml",
    "docs/exec-plans/evidence/KL-013/checks-b0c5d4a.log"
  ],
  "review_contract_version": "v0.2"
}
