{
  "task_identity": "harness-governance-v0.1/HG-047",
  "reviewed_head_sha": "b7370940c8b9165f471322baaeef7d9e250dfac6",
  "review_type": "SECURITY_DATA_BOUNDARY",
  "status": "PASS",
  "findings": [],
  "evidence_refs": [
    "docs/exec-plans/reviews/HG-047/security_round2/decoder-security.log",
    "docs/exec-plans/reviews/HG-047/security_round2/m3-regression.log",
    "docs/exec-plans/reviews/HG-047/security_round2/new-cases-collection.log",
    "docs/exec-plans/reviews/HG-047/security_round2/verification.log",
    "docs/exec-plans/reviews/HG-047/security_round2/budget.log",
    "docs/exec-plans/governance/HG-047.yaml",
    "docs/exec-plans/evidence/HG-047/round2-536c9b7/execution.json",
    "docs/exec-plans/evidence/HG-047/round2-536c9b7/harness.json",
    "docs/exec-plans/evidence/HG-047/round2-536c9b7/unit.json",
    "docs/exec-plans/evidence/HG-047/round2-536c9b7/scope.json",
    "docs/exec-plans/evidence/HG-047/round2-536c9b7/authority.json"
  ],
  "review_contract_version": "v0.2"
}
